<?xml version="1.0"?>

<!DOCTYPE agenda SYSTEM "ejercicio_2.dtd">
<agenda>
  <contacto tipo="profesional">
    <nombre>Ana López</nombre>
    <telefono>123456789</telefono>
    
  </contacto>
  <contacto tipo="profesional">
    <nombre>Ana López</nombre>
    <telefono>123456789</telefono>
    <email>ana@empresa.com</email>
  </contacto>
</agenda>
